[
  {
    "id": "bs-katraj-chowk",
    "name": "Katraj Chowk, Pune-Satara Road",
    "lat": 18.4536792,
    "lng": 73.8563196,
    "crashCount": 22,
    "period": "2022-2024",
    "evidenceLevel": "counted",
    "sourceName": "Pune City Police Road Safety Report (Jan 2026)",
    "sourceUrl": "https://www.punekarnews.in/?p=225932",
    "sourceNote": "Identified as one of 20 MoRTH black spots for 2022-2024 with 22 crashes.",
    "coordinateSource": "geocoded_osm",
    "coordinatesVerified": false
  },
  {
    "id": "bs-perne-phata",
    "name": "Perne Phata, Pune-Ahmednagar Road",
    "lat": 18.6320182,
    "lng": 74.0639545,
    "crashCount": 22,
    "period": "2022-2024",
    "evidenceLevel": "counted",
    "sourceName": "Pune City Police Road Safety Report (Jan 2026)",
    "sourceUrl": "https://www.punekarnews.in/?p=225932",
    "sourceNote": "Identified as one of 20 MoRTH black spots for 2022-2024 with 22 crashes.",
    "coordinateSource": "geocoded_osm",
    "coordinatesVerified": false
  },
  {
    "id": "bs-new-katraj-tunnel-road",
    "name": "New Katraj Tunnel Road",
    "lat": 18.4003395,
    "lng": 73.8493141,
    "crashCount": null,
    "period": "2021",
    "evidenceLevel": "listed_only",
    "sourceName": "Punekar News (15 Jan 2022)",
    "sourceUrl": "https://www.punekarnews.in/?p=104358",
    "sourceNote": "Listed among 19 accident-prone spots identified by Pune Police from 2021 data.",
    "coordinateSource": "geocoded_osm",
    "coordinatesVerified": false
  },
  {
    "id": "bs-dari-pul-bridge-road",
    "name": "Dari Pul bridge Road",
    "lat": 18.415,
    "lng": 73.845,
    "crashCount": null,
    "period": "2021",
    "evidenceLevel": "listed_only",
    "sourceName": "Punekar News (15 Jan 2022)",
    "sourceUrl": "https://www.punekarnews.in/?p=104358",
    "sourceNote": "Listed among 19 accident-prone spots identified by Pune Police from 2021 data.",
    "coordinateSource": "estimated",
    "coordinatesVerified": false
  },
  {
    "id": "bs-navale-bridge-chowk",
    "name": "Navale Bridge Chowk",
    "lat": 18.4599857,
    "lng": 73.8231277,
    "crashCount": null,
    "period": "2021",
    "evidenceLevel": "listed_only",
    "sourceName": "Punekar News (15 Jan 2022)",
    "sourceUrl": "https://www.punekarnews.in/?p=104358",
    "sourceNote": "Listed among 19 accident-prone spots identified by Pune Police from 2021 data.",
    "coordinateSource": "geocoded_osm",
    "coordinatesVerified": false
  },
  {
    "id": "bs-bhumkar-bridge-chowk",
    "name": "Bhumkar Bridge Chowk",
    "lat": 18.6054357,
    "lng": 73.7521665,
    "crashCount": null,
    "period": "2021",
    "evidenceLevel": "listed_only",
    "sourceName": "Punekar News (15 Jan 2022)",
    "sourceUrl": "https://www.punekarnews.in/?p=104358",
    "sourceNote": "Listed among 19 accident-prone spots identified by Pune Police from 2021 data.",
    "coordinateSource": "geocoded_osm",
    "coordinatesVerified": false
  },
  {
    "id": "bs-vaiduwadi-chowk",
    "name": "Vaiduwadi Chowk",
    "lat": 18.5045,
    "lng": 73.918,
    "crashCount": null,
    "period": "2021",
    "evidenceLevel": "listed_only",
    "sourceName": "Punekar News (15 Jan 2022)",
    "sourceUrl": "https://www.punekarnews.in/?p=104358",
    "sourceNote": "Listed among 19 accident-prone spots identified by Pune Police from 2021 data.",
    "coordinateSource": "estimated",
    "coordinatesVerified": false
  },
  {
    "id": "bs-phursungi-phata-chowk",
    "name": "Phursungi Phata Chowk",
    "lat": 18.4726271,
    "lng": 73.9791077,
    "crashCount": null,
    "period": "2021",
    "evidenceLevel": "listed_only",
    "sourceName": "Punekar News (15 Jan 2022)",
    "sourceUrl": "https://www.punekarnews.in/?p=104358",
    "sourceNote": "Listed among 19 accident-prone spots identified by Pune Police from 2021 data.",
    "coordinateSource": "geocoded_osm",
    "coordinatesVerified": false
  },
  {
    "id": "bs-phursungi-railway-bridge-road",
    "name": "Phursungi Railway bridge Road",
    "lat": 18.4572003,
    "lng": 74.0021566,
    "crashCount": null,
    "period": "2021",
    "evidenceLevel": "listed_only",
    "sourceName": "Punekar News (15 Jan 2022)",
    "sourceUrl": "https://www.punekarnews.in/?p=104358",
    "sourceNote": "Listed among 19 accident-prone spots identified by Pune Police from 2021 data.",
    "coordinateSource": "geocoded_osm",
    "coordinatesVerified": false
  },
  {
    "id": "bs-saswad-road-near-ibm",
    "name": "Saswad Road near IBM Company",
    "lat": 18.4951182,
    "lng": 73.9452858,
    "crashCount": null,
    "period": "2021",
    "evidenceLevel": "listed_only",
    "sourceName": "Punekar News (15 Jan 2022)",
    "sourceUrl": "https://www.punekarnews.in/?p=104358",
    "sourceNote": "Listed among 19 accident-prone spots identified by Pune Police from 2021 data.",
    "coordinateSource": "geocoded_osm",
    "coordinatesVerified": false
  },
  {
    "id": "bs-mutha-river-bridge-chowk",
    "name": "Mutha River Bridge Chowk",
    "lat": 18.478,
    "lng": 73.805,
    "crashCount": null,
    "period": "2021",
    "evidenceLevel": "listed_only",
    "sourceName": "Punekar News (15 Jan 2022)",
    "sourceUrl": "https://www.punekarnews.in/?p=104358",
    "sourceNote": "Listed among 19 accident-prone spots identified by Pune Police from 2021 data.",
    "coordinateSource": "estimated",
    "coordinatesVerified": false
  },
  {
    "id": "bs-dukkarkhind-road",
    "name": "Dukkarkhind Road",
    "lat": 18.495,
    "lng": 73.795,
    "crashCount": null,
    "period": "2021",
    "evidenceLevel": "listed_only",
    "sourceName": "Punekar News (15 Jan 2022)",
    "sourceUrl": "https://www.punekarnews.in/?p=104358",
    "sourceNote": "Listed among 19 accident-prone spots identified by Pune Police from 2021 data.",
    "coordinateSource": "estimated",
    "coordinatesVerified": false
  },
  {
    "id": "bs-mai-mangeshkar-hospital-road",
    "name": "Mai Mangeshkar Hospital Road",
    "lat": 18.4851843,
    "lng": 73.7997318,
    "crashCount": null,
    "period": "2021",
    "evidenceLevel": "listed_only",
    "sourceName": "Punekar News (15 Jan 2022)",
    "sourceUrl": "https://www.punekarnews.in/?p=104358",
    "sourceNote": "Listed among 19 accident-prone spots identified by Pune Police from 2021 data.",
    "coordinateSource": "geocoded_osm",
    "coordinatesVerified": false
  },
  {
    "id": "bs-tata-guard-room-chowk",
    "name": "Tata Guard Room Chowk",
    "lat": 18.6382629,
    "lng": 73.7856697,
    "crashCount": null,
    "period": "2021",
    "evidenceLevel": "listed_only",
    "sourceName": "Punekar News (15 Jan 2022)",
    "sourceUrl": "https://www.punekarnews.in/?p=104358",
    "sourceNote": "Listed among 19 accident-prone spots identified by Pune Police from 2021 data.",
    "coordinateSource": "geocoded_osm",
    "coordinatesVerified": false
  },
  {
    "id": "bs-kharadi-bypass-chowk",
    "name": "Kharadi Bypass Chowk",
    "lat": 18.5496557,
    "lng": 73.9369177,
    "crashCount": null,
    "period": "2021",
    "evidenceLevel": "listed_only",
    "sourceName": "Punekar News (15 Jan 2022)",
    "sourceUrl": "https://www.punekarnews.in/?p=104358",
    "sourceNote": "Listed among 19 accident-prone spots identified by Pune Police from 2021 data.",
    "coordinateSource": "geocoded_osm",
    "coordinatesVerified": false
  }
]
